[
  {
    "_id": "2026-05-22-uniaccess-xavier-university-t001",
    "tenantId": "toc",
    "sessionId": "2026-05-22-uniaccess-xavier-university",
    "speakerRef": "Sandeep",
    "tStart": 1,
    "tEnd": 3,
    "text": "next one hour,"
  },
  {
    "_id": "2026-05-22-uniaccess-xavier-university-t002",
    "tenantId": "toc",
    "sessionId": "2026-05-22-uniaccess-xavier-university",
    "speakerRef": "Sandeep",
    "tStart": 3,
    "tEnd": 11,
    "text": "We just completed the presentation, so I hope you guys like it. I'm happy to send the either of the two. In the meanwhile, I just check with Ansha is is the—"
  },
  {
    "_id": "2026-05-22-uniaccess-xavier-university-t003",
    "tenantId": "toc",
    "sessionId": "2026-05-22-uniaccess-xavier-university",
    "speakerRef": "Vijoya",
    "tStart": 11,
    "tEnd": 14,
    "text": "Is my screen visible?"
  },
  {
    "_id": "2026-05-22-uniaccess-xavier-university-t004",
    "tenantId": "toc",
    "sessionId": "2026-05-22-uniaccess-xavier-university",
    "speakerRef": "Sandeep",
    "tStart": 14,
    "tEnd": 15,
    "text": "No."
  },
  {
    "_id": "2026-05-22-uniaccess-xavier-university-t005",
    "tenantId": "toc",
    "sessionId": "2026-05-22-uniaccess-xavier-university",
    "speakerRef": "Vijoya",
    "tStart": 15,
    "tEnd": 20,
    "text": "Okay. Try again."
  },
  {
    "_id": "2026-05-22-uniaccess-xavier-university-t006",
    "tenantId": "toc",
    "sessionId": "2026-05-22-uniaccess-xavier-university",
    "speakerRef": "Sandeep",
    "tStart": 20,
    "tEnd": 24,
    "text": "Vijoya, what I'll do for your references, maybe I can share the presentation with you."
  },
  {
    "_id": "2026-05-22-uniaccess-xavier-university-t007",
    "tenantId": "toc",
    "sessionId": "2026-05-22-uniaccess-xavier-university",
    "speakerRef": "Vijoya",
    "tStart": 24,
    "tEnd": 26,
    "text": "Yeah, that works. You can share."
  },
  {
    "_id": "2026-05-22-uniaccess-xavier-university-t008",
    "tenantId": "toc",
    "sessionId": "2026-05-22-uniaccess-xavier-university",
    "speakerRef": "Vijoya",
    "tStart": 26,
    "tEnd": 29,
    "text": "No, I'm not able to present."
  },
  {
    "_id": "2026-05-22-uniaccess-xavier-university-t009",
    "tenantId": "toc",
    "sessionId": "2026-05-22-uniaccess-xavier-university",
    "speakerRef": "Sandeep",
    "tStart": 29,
    "tEnd": 58,
    "text": "Yeah, it's all okay, don't worry. I think we are good, and normally this happens, so please bear with me. But thank you so much to everyone for giving me your evening today. I think, during the sort of the time that we have, my intention would be to just take you through what Xavier is all about. Why do I still love Xavier a lot? Normally, this is something that a lot—"
  },
  {
    "_id": "2026-05-22-uniaccess-xavier-university-t010",
    "tenantId": "toc",
    "sessionId": "2026-05-22-uniaccess-xavier-university",
    "speakerRef": "Sandeep",
    "tStart": 58,
    "tEnd": 91,
    "text": "join an institution and then you are done, you feel like, \"Hey, maybe should I still be in? Should I move out?\" A lot of things. But I I feel, with Xavier, something that has always and always kept me captivated and engaged has been the fact that that I really love the institution, and I really love the way they are. So, I think that has really kept me there. So, while I drop in a text to Vijoya, so Vijoya should be able to download,"
  },
  {
    "_id": "2026-05-22-uniaccess-xavier-university-t011",
    "tenantId": "toc",
    "sessionId": "2026-05-22-uniaccess-xavier-university",
    "speakerRef": "Sandeep",
    "tStart": 91,
    "tEnd": 107,
    "text": "what I'll do is I'll take you through through Xavier. So, while she tries to do this, let me give you an idea about what Xavier is. To a casual observer, Xavier—"
  },
  {
    "_id": "2026-05-22-uniaccess-xavier-university-t012",
    "tenantId": "toc",
    "sessionId": "2026-05-22-uniaccess-xavier-university",
    "speakerRef": "Sandeep",
    "tStart": 107,
    "tEnd": 120,
    "text": "How many of you have been to Xavier at all, like ever, or you have never been? I'm guessing not many people would have been there. Okay. So, that gives me and Ansha a good idea in terms of who all to invite for our campus trip, whenever that happens."
  },
  {
    "_id": "2026-05-22-uniaccess-xavier-university-t013",
    "tenantId": "toc",
    "sessionId": "2026-05-22-uniaccess-xavier-university",
    "speakerRef": "Sandeep",
    "tStart": 120,
    "tEnd": 153,
    "text": "But, I mean, I think what keeps Xavier a lot sane as a university is the way they are. To a casual observer, it's just a beautiful collegiate Gothic architecture, but to the students at Xavier in Cincinnati, those towers represent something much deeper. They They represent a 193-year-old promise, which really says all for one. Now that you may have heard about a lot of mission statements before, but as counselors,"
  },
  {
    "_id": "2026-05-22-uniaccess-xavier-university-t014",
    "tenantId": "toc",
    "sessionId": "2026-05-22-uniaccess-xavier-university",
    "speakerRef": "Sandeep",
    "tStart": 153,
    "tEnd": 172,
    "text": "you know that for a 17-year-old looking for their home for the next four four years, mission statement of any university is just words until it becomes an experience. So, today, I'm not just here to give you stats on our 80 plus majors, 11:1 student-to-faculty ratio, which I'm"
  },
  {
    "_id": "2026-05-22-uniaccess-xavier-university-t015",
    "tenantId": "toc",
    "sessionId": "2026-05-22-uniaccess-xavier-university",
    "speakerRef": "Sandeep",
    "tStart": 172,
    "tEnd": 203,
    "text": "sure they're impressive, but it's the reason why our graduates don't just find jobs, they find a sense of purpose. It's It's why in a world that focuses often where people get divided, and this is where our students live by the Jesuit value of Cura Personalis, which basically means care for the entire person. So, whether they are screaming their heads off, a packed Cintas Center for Musketeers' basketball game, or engaging in a deep reflection during a community service project in downtown Cincinnati,"
  },
  {
    "_id": "2026-05-22-uniaccess-xavier-university-t016",
    "tenantId": "toc",
    "sessionId": "2026-05-22-uniaccess-xavier-university",
    "speakerRef": "Sandeep",
    "tStart": 203,
    "tEnd": 222,
    "text": "our students are learning that they belong to something bigger than themselves. Over the next few minutes, I'm going to show you why Xavier is the Goldilocks school for many of the students. Big enough to offer world-class opportunities, but most importantly, small enough"
  },
  {
    "_id": "2026-05-22-uniaccess-xavier-university-t017",
    "tenantId": "toc",
    "sessionId": "2026-05-22-uniaccess-xavier-university",
    "speakerRef": "Sandeep",
    "tStart": 222,
    "tEnd": 241,
    "text": "that no one, and I mean no one, is just a number. So, let's dive into what makes Xavier experience truly all for one. Thank you, Vijoya, for helping with this. Can we come onto the next slide now? I think I can do that. Okay, perfect."
  },
  {
    "_id": "2026-05-22-uniaccess-xavier-university-t018",
    "tenantId": "toc",
    "sessionId": "2026-05-22-uniaccess-xavier-university",
    "speakerRef": "Sandeep",
    "tStart": 241,
    "tEnd": 271,
    "text": "Now that we have done the introductions, I also want to take a moment to really talk about what makes Xavier different. Because for many students, choosing university is not just about rankings, majors, or even scholarship. It's It's about environment. It's about where they grow. And at Xavier, one of the things students firmly notice very quickly is that they are never treated like just another number in a system. It's a community-centered university,"
  },
  {
    "_id": "2026-05-22-uniaccess-xavier-university-t019",
    "tenantId": "toc",
    "sessionId": "2026-05-22-uniaccess-xavier-university",
    "speakerRef": "Sandeep",
    "tStart": 271,
    "tEnd": 307,
    "text": "and that changes the student experience completely. So, when students walk into a class, professors know their name, they notice when someone is struggling, they they basically try to challenge the kids, but they also support them. And, most importantly, as an international student coming from thousands of miles away from home, that kind of environment matters more than the peers realize. Xavier has a very strong culture of mentorship and accessibility. Faculty members are deeply invested, but not only in just the academic success, but also in helping students discover confidence,"
  },
  {
    "_id": "2026-05-22-uniaccess-xavier-university-t020",
    "tenantId": "toc",
    "sessionId": "2026-05-22-uniaccess-xavier-university",
    "speakerRef": "Sandeep",
    "tStart": 307,
    "tEnd": 339,
    "text": "direction, and purpose. A A lot of learning really happens outside the classroom as well. Through leadership opportunities, student organization organizations, service experiences, internships, and, most importantly, the conversations that shape students personally and professionally. Honestly, if I were just to think about, as a counselor, we speak a lot about families and counselors."
  },
  {
    "_id": "2026-05-22-uniaccess-xavier-university-t021",
    "tenantId": "toc",
    "sessionId": "2026-05-22-uniaccess-xavier-university",
    "speakerRef": "Sandeep",
    "tStart": 339,
    "tEnd": 372,
    "text": "Because students are entering university at a stage where they feel that they are discovering who they are, the right university, I feel, should help them to grow into themselves, not just prepare them for a job. So, when we talk about Xavier, we are really talking about a place where students are supported academically, personally, and professionally. And, this is This is a place where they can actually explore who they want to become, while they are still trying to feel feel seen"
  },
  {